{"decision_version":"1.0","decision_id":"aaaaaaaaaaaaaaaaaaaaaaaaaaaaaaaaaaaaaaaaaaaaaaaaaaaaaaaaaaaaaaaa","outcome":"admit_read","stable_reason_code":"admit_read","applied_rule_ids":["allow-local-adr-read","mode-read-only","org-read-only","repo-read-only","runtime-read-demonstrated"],"intent_digest":"bbbbbbbbbbbbbbbbbbbbbbbbbbbbbbbbbbbbbbbbbbbbbbbbbbbbbbbbbbbbbbbb","effective_scope":{"kind":"filesystem","path":"docs/architecture-decision-records/0007-runtime-and-tool-policy-boundary.md"},"bindings":{"profile_sha256":"aaaaaaaaaaaaaaaaaaaaaaaaaaaaaaaaaaaaaaaaaaaaaaaaaaaaaaaaaaaaaaaa","policy_sha256":"bbbbbbbbbbbbbbbbbbbbbbbbbbbbbbbbbbbbbbbbbbbbbbbbbbbbbbbbbbbbbbbb","run_id":"run-h2-02","operation_id":"read-adr","effective_scope":{"kind":"filesystem","path":"docs/architecture-decision-records/0007-runtime-and-tool-policy-boundary.md"},"max_output_bytes":64},"provenance":{"pdp_version":"1.0","kind":"local_pure_pdp"}}
